### ISSUE TITLE
HTTP client not closing TCP connections?

### ISSUE THREAD

**Issue by SimonSapin** [servo/servo#19439]
Steps to reproduce:

* Revert #19437: in `make_server` in `tests/unit/net/lib.rs`, set the number of threads in `.handle_threads(handler, 2)` back to 1 instead of 2.
* Run `./mach test-unit -p net test_redirect_from_x_to_y_provides_y_cookies_from_y`
* Observe that this test takes over 5 seconds to run, whereas other tests in the same module finish much more quickly (Run `RUST_TEST_THREADS=1 ./mach test-unit -p net` to compare.)

The output of tshark (command-line Wireshark) while running the test looks like this:

```
% tshark -i lo
Capturing on 'Loopback'
    1 0.000000000    127.0.0.1 → 127.0.0.1    TCP 74 42514 → 37475 [SYN] Seq=0 Win=43690 Len=0 MSS=65495 SACK_PERM=1 TSval=1341075797 TSecr=0 WS=128
    2 0.000004948    127.0.0.1 → 127.0.0.1    TCP 74 37475 → 42514 [SYN, ACK] Seq=0 Ack=1 Win=43690 Len=0 MSS=65495 SACK_PERM=1 TSval=1341075797 TSecr=1341075797 WS=128
    3 0.000009591    127.0.0.1 → 127.0.0.1    TCP 66 42514 → 37475 [ACK] Seq=1 Ack=1 Win=43776 Len=0 TSval=1341075797 TSecr=1341075797
    4 0.000096440    127.0.0.1 → 127.0.0.1    HTTP 336 GET /com/ HTTP/1.1 
    5 0.000105283    127.0.0.1 → 127.0.0.1    TCP 66 37475 → 42514 [ACK] Seq=1 Ack=271 Win=44800 Len=0 TSval=1341075797 TSecr=1341075797
    6 0.000228061    127.0.0.1 → 127.0.0.1    HTTP 197 HTTP/1.1 301 Moved Permanently 
    7 0.000251257    127.0.0.1 → 127.0.0.1    TCP 66 42514 → 37475 [ACK] Seq=271 Ack=132 Win=44800 Len=0 TSval=1341075797 TSecr=1341075797
    8 0.001630331    127.0.0.1 → 127.0.0.1    TCP 74 42516 → 37475 [SYN] Seq=0 Win=43690 Len=0 MSS=65495 SACK_PERM=1 TSval=1341075798 TSecr=0 WS=128
    9 0.001634059    127.0.0.1 → 127.0.0.1    TCP 74 37475 → 42516 [SYN, ACK] Seq=0 Ack=1 Win=43690 Len=0 MSS=65495 SACK_PERM=1 TSval=1341075798 TSecr=1341075798 WS=128
   10 0.001637592    127.0.0.1 → 127.0.0.1    TCP 66 42516 → 37475 [ACK] Seq=1 Ack=1 Win=43776 Len=0 TSval=1341075798 TSecr=1341075798
   11 0.001705484    127.0.0.1 → 127.0.0.1    HTTP 334 GET /org/ HTTP/1.1 
   12 0.001707773    127.0.0.1 → 127.0.0.1    TCP 66 37475 → 42516 [ACK] Seq=1 Ack=269 Win=44800 Len=0 TSval=1341075798 TSecr=1341075798
   13 5.228807172    127.0.0.1 → 127.0.0.1    TCP 66 37475 → 42514 [FIN, ACK] Seq=132 Ack=271 Win=44800 Len=0 TSval=1341081025 TSecr=1341075797
   14 5.228920243    127.0.0.1 → 127.0.0.1    HTTP 145 HTTP/1.1 200 OK 
   15 5.228949699    127.0.0.1 → 127.0.0.1    TCP 66 42516 → 37475 [ACK] Seq=269 Ack=80 Win=43776 Len=0 TSval=1341081026 TSecr=1341081026
   16 5.230553051    127.0.0.1 → 127.0.0.1    TCP 66 42516 → 37475 [FIN, ACK] Seq=269 Ack=80 Win=43776 Len=0 TSval=1341081027 TSecr=1341081026
   17 5.230561790    127.0.0.1 → 127.0.0.1    TCP 66 42514 → 37475 [FIN, ACK] Seq=271 Ack=133 Win=44800 Len=0 TSval=1341081027 TSecr=1341081025
   18 5.230564901    127.0.0.1 → 127.0.0.1    TCP 66 37475 → 42514 [ACK] Seq=133 Ack=272 Win=44800 Len=0 TSval=1341081027 TSecr=1341081027
   19 5.230583717    127.0.0.1 → 127.0.0.1    TCP 66 37475 → 42516 [FIN, ACK] Seq=80 Ack=270 Win=44800 Len=0 TSval=1341081027 TSecr=1341081027
   20 5.230588986    127.0.0.1 → 127.0.0.1    TCP 66 42516 → 37475 [ACK] Seq=270 Ack=81 Win=43776 Len=0 TSval=1341081027 TSecr=1341081027
^C20 packets captured
```

This test makes an HTTP request to a single-threaded server. The first response is a redirect, so we send a second request. The client’s port number is different, so it looks like we’re opening a new TCP connection. The second request is made quickly, but the first TCP connection is only closed (`FIN, ACK`) after ~5 seconds. Only then (as shown if we add some `println!` statements in the `handler` closure` is the second requested handled.

5 second matches the default keep-alive in Hyper: https://docs.rs/hyper/0.10.13/hyper/server/struct.Server.html#method.keep_alive Indeed, the `FIN, ACK` packet is sent by the server (origin port number 37475).

So it looks like after making an HTTP request, we leave the TCP connection open and don’t re-use it for connecting again to the same server IP address. Note however that the two requests use different host names, so maybe this is deliberate? Maybe a cross-origin policy thing?

**Comment by jdm** [comment]
Yeah, we have a connection pool to reuse connections for the same hostname.

**Comment by SimonSapin** [comment]
Does it need to be same hostname rather than same IP address? At least for HTTP where there’s no certificate whose verification is hostname-specific.

**Comment by jdm** [comment]
That is a function of hyper's connection pool: https://github.com/hyperium/hyper/blob/0.10.x/src/client/pool.rs#L57

**Comment by SimonSapin** [comment]
Alright. So should we close this as not-a-bug?

**Comment by jdm** [comment]
I guess so!
